{
  "id": "gochujang-pork-tenderloin-batch",
  "schema_version": 1,
  "title": "Gochujang Pork Tenderloin",
  "subtitle": "Sheet-pan batch. 4 servings. 12 min prep, 25 min roast.",
  "created": "2026-05-13",
  "updated": "2026-05-13",
  "source": "personal",

  "tags": ["korean", "high-protein", "batch", "meal-prep", "sheet-pan", "freezer-friendly"],
  "cuisine": "korean",
  "meal_type": ["lunch", "dinner"],
  "diet_flags": ["dairy-free", "high-protein"],

  "servings": 4,
  "yield_type": "per-serving",
  "time": { "prep_min": 12, "cook_min": 25, "total_min": 37, "rest_min": 5 },

  "macros_per_serving": {
    "kcal": 430,
    "protein_g": 57,
    "carbs_g": 22,
    "fat_g": 12,
    "fiber_g": 3,
    "sodium_mg": 1100
  },

  "ingredients": [
    { "qty": 1100, "unit": "g", "item": "pork tenderloin", "prep": "trimmed of silver-skin", "category": "protein", "thai_market_tip": "Tops/Makro carry whole tenderloins in vac-pack. Cheapest lean protein per gram in the supermarket. Trim the silver-skin or it'll be chewy." },
    { "qty": 3, "unit": "tbsp", "item": "gochujang (Korean chili paste)", "category": "pantry", "thai_market_tip": "Chung Jung One red tub, Korean aisle." },
    { "qty": 2, "unit": "tbsp", "item": "soy sauce", "category": "pantry" },
    { "qty": 2, "unit": "tbsp", "item": "rice vinegar", "category": "pantry" },
    { "qty": 1, "unit": "tbsp", "item": "honey", "category": "pantry" },
    { "qty": 1, "unit": "tbsp", "item": "sesame oil", "category": "pantry", "note": "Goes in the glaze — total fat for 4 servings, well within oil cap." },
    { "qty": 4, "unit": "clove", "item": "garlic", "prep": "grated", "category": "produce" },
    { "qty": 1, "unit": "piece", "item": "ginger, thumb-sized", "prep": "grated", "category": "produce" },
    { "qty": 2, "unit": "piece", "item": "zucchini", "prep": "1.5cm half-moons", "category": "produce" },
    { "qty": 1, "unit": "piece", "item": "red bell pepper", "prep": "2cm chunks", "category": "produce" },
    { "qty": 1, "unit": "piece", "item": "yellow onion", "prep": "wedges", "category": "produce" },
    { "qty": 1, "unit": "tsp", "item": "neutral oil", "category": "pantry", "note": "For tossing the vegetables." },
    { "qty": 1, "unit": "tbsp", "item": "toasted sesame seeds", "category": "pantry" },
    { "qty": 2, "unit": "piece", "item": "spring onion", "prep": "thin-sliced on the bias", "category": "produce" }
  ],

  "substitutions": [
    {
      "swap_out": "pork tenderloin",
      "swap_in": "chicken breast",
      "ratio": "1:1",
      "macro_delta": { "kcal": -20, "protein_g": 4, "fat_g": -3 },
      "note": "Cook 18 min instead of 25. Brine 15 min first or it'll dry."
    },
    {
      "swap_out": "honey",
      "swap_in": "monk fruit sweetener (granulated)",
      "ratio": "1:1",
      "macro_delta": { "kcal": -50, "carbs_g": -14 },
      "note": "Loses some glaze shine, drops 50 kcal across the batch."
    }
  ],

  "steps": [
    { "n": 1, "text": "Preheat oven 220°C / 425°F.", "timer_min": null },
    { "n": 2, "text": "Whisk gochujang, soy, rice vinegar, honey, sesame oil, garlic, ginger. Reserve 1/3 for serving — the other 2/3 is the cooking glaze.", "timer_min": null },
    { "n": 3, "text": "Brush cooking glaze all over tenderloins. Lay on one half of a sheet pan, lined with parchment.", "timer_min": null },
    { "n": 4, "text": "Toss vegetables with 1 tsp neutral oil, salt. Spread on the other half of the sheet pan.", "timer_min": null },
    { "n": 5, "text": "Roast 22–25 min until internal temp is 63°C / 145°F at the thickest part. Vegetables should char at the edges.", "timer_min": 25 },
    { "n": 6, "text": "Rest tenderloins 5 min, then slice into 1.5cm medallions.", "timer_min": 5 },
    { "n": 7, "text": "Portion into 4 containers: 1/4 of pork, 1/4 of vegetables, drizzle of reserved glaze, sesame + spring onion. Keeps 4 days fridge.", "timer_min": null }
  ],

  "serves_with": [
    { "ref": "microwave-brown-rice", "note": "1 pack adds ~200 kcal / 43g carbs. Best with the leftover glaze drizzled over." },
    { "ref": "kimchi", "note": "Standard side. +0 kcal." }
  ],

  "notes": "Pork tenderloin is the most underrated protein in the Thai supermarket — cheap, lean, big macros, and the gochujang glaze hides any blandness. 63°C internal is the sweet spot (juicy, safe). Rest is non-negotiable; cut early and you bleed all the juice. Reserve a third of the glaze raw — it stays brighter than the roasted version.",

  "favorite": false,
  "cook_count": 0,
  "last_cooked": null
}
