{
  "id": "pad-krapow-gai",
  "schema_version": 1,
  "title": "Pad Krapow Gai",
  "subtitle": "Thai holy basil chicken. 5 min prep, 8 min cook.",
  "created": "2026-05-13",
  "updated": "2026-05-13",
  "source": "personal",

  "tags": ["thai", "high-protein", "quick", "one-pan", "weeknight"],
  "cuisine": "thai",
  "meal_type": ["lunch", "dinner"],
  "diet_flags": ["dairy-free", "high-protein"],

  "servings": 2,
  "yield_type": "per-serving",
  "time": {
    "prep_min": 5,
    "cook_min": 8,
    "total_min": 13
  },

  "macros_per_serving": {
    "kcal": 400,
    "protein_g": 57,
    "carbs_g": 9,
    "fat_g": 14,
    "fiber_g": 2,
    "sodium_mg": 1400
  },

  "ingredients": [
    {
      "qty": 500,
      "unit": "g",
      "item": "chicken thigh, boneless skinless",
      "prep": "minced",
      "category": "protein",
      "thai_market_tip": "Ask the Tops/Villa butcher to mince it — faster and far less cleanup. Thigh is more forgiving than breast at high heat.",
      "optional": false
    },
    {
      "qty": 2,
      "unit": "piece",
      "item": "egg",
      "prep": "whole, fried sunny-side",
      "category": "protein",
      "optional": false,
      "note": "One egg per serving, fried in the same pan after the chicken."
    },
    {
      "qty": 1,
      "unit": "tsp",
      "item": "neutral oil",
      "category": "pantry",
      "optional": false,
      "note": "Oil cap — do not exceed. Split: half for chicken, half for eggs."
    },
    {
      "qty": 6,
      "unit": "clove",
      "item": "garlic",
      "prep": "roughly pounded",
      "category": "produce",
      "optional": false,
      "note": "Pound with the chilies in a mortar — don't fine-mince."
    },
    {
      "qty": 4,
      "unit": "piece",
      "item": "Thai bird's eye chili (prik kee noo)",
      "prep": "pounded with garlic",
      "category": "produce",
      "optional": true,
      "note": "Halve or skip for mild. Fresh markets sell them by the bag."
    },
    {
      "qty": 2,
      "unit": "tbsp",
      "item": "oyster sauce",
      "category": "pantry",
      "thai_market_tip": "Maekrua or Lee Kum Kee — both fine. Maekrua is the local default.",
      "optional": false
    },
    {
      "qty": 1,
      "unit": "tbsp",
      "item": "fish sauce",
      "category": "pantry",
      "optional": false
    },
    {
      "qty": 1,
      "unit": "tsp",
      "item": "dark sweet soy sauce (si-ew dam)",
      "category": "pantry",
      "thai_market_tip": "Healthy Boy brand, dark soy aisle. Adds the brown lacquer colour.",
      "optional": false
    },
    {
      "qty": 1,
      "unit": "tsp",
      "item": "sugar",
      "category": "pantry",
      "optional": false
    },
    {
      "qty": 2,
      "unit": "cup",
      "item": "holy basil (krapow)",
      "prep": "leaves picked",
      "category": "produce",
      "thai_market_tip": "MUST be holy basil (bai krapow), not sweet Thai basil (bai horapha). Fresh markets only — supermarket bags are usually horapha. If you can't find krapow, this is pad horapha, not pad krapow.",
      "optional": false
    },
    {
      "qty": 2,
      "unit": "tbsp",
      "item": "chicken stock or water",
      "category": "pantry",
      "optional": false,
      "note": "Splash to deglaze and emulsify the sauce."
    }
  ],

  "substitutions": [
    {
      "swap_out": "chicken thigh, boneless skinless",
      "swap_in": "chicken breast",
      "ratio": "1:1",
      "macro_delta": {
        "kcal": -50,
        "protein_g": 8,
        "fat_g": -8
      },
      "note": "Higher protein, leaner. Easier to overcook — pull from heat the moment it loses pink."
    },
    {
      "swap_out": "chicken thigh, boneless skinless",
      "swap_in": "lean ground pork",
      "ratio": "1:1",
      "macro_delta": {
        "kcal": 40,
        "protein_g": -2,
        "fat_g": 4
      },
      "note": "The traditional version is pork (pad krapow moo). Slightly fattier."
    },
    {
      "swap_out": "egg",
      "swap_in": "egg whites",
      "ratio": "1 egg = 3 whites",
      "macro_delta": {
        "kcal": -50,
        "protein_g": 2,
        "fat_g": -5
      },
      "note": "Lose the runny yolk but cut fat. Less satisfying."
    }
  ],

  "steps": [
    {
      "n": 1,
      "text": "Pound garlic + chilies in mortar to rough paste. No mortar: smash flat with side of knife, then chop.",
      "timer_min": null
    },
    {
      "n": 2,
      "text": "Heat 1/2 tsp oil in non-stick wok or pan, high. Add garlic-chili paste, stir 15 sec until fragrant.",
      "timer_min": null
    },
    {
      "n": 3,
      "text": "Add minced chicken. Break up, press flat, leave 30 sec to brown, then stir-fry until no pink, ~4 min.",
      "timer_min": 4
    },
    {
      "n": 4,
      "text": "Add oyster sauce, fish sauce, dark soy, sugar, stock. Toss to coat. Cook 1 min until glossy.",
      "timer_min": 1
    },
    {
      "n": 5,
      "text": "Kill heat. Throw in holy basil, toss twice — leaves should wilt from residual heat, not cook.",
      "timer_min": null
    },
    {
      "n": 6,
      "text": "Plate. Wipe pan, add remaining 1/2 tsp oil on high, crack eggs and fry hard — crispy edges, runny yolk. Slide onto each plate.",
      "timer_min": 2
    }
  ],

  "serves_with": [
    {
      "ref": "microwave-jasmine-rice",
      "note": "Standard. Adds ~200 kcal / 43g carbs per pack."
    },
    {
      "ref": "cucumber-slices",
      "note": "Cooling counterpoint. Free macros."
    }
  ],

  "notes": "Real pad krapow lives or dies on the basil. Holy basil (krapow) is peppery, almost clove-like — sweet Thai basil (horapha) is anise-y and wrong for this dish. The fried egg with runny yolk is non-negotiable; the yolk is the sauce. Pound the garlic and chilies — don't mince — for the right rough texture.",

  "favorite": false,
  "cook_count": 0,
  "last_cooked": null
}
